PaperTitle,Year,Journal,FirstAuthorName,FirstAuthorCountry,CountryDataCollected,SamplePrimaryCountryofOrigin,Ethnicity,SampleSize,SampleAgeMean,SampleAgeSD,FemaleParticipantsNumber,MaleParticipantsNumber,,SampleOtherDescription,SampleMusicianshipDescription,SamplingMethodDescription,MeanYearsEducation,MusicPrimaryGenre,MusicOriginCountry,MusicSource,Comments,CoderName,Keywords
Growing older in a symphony orchestra: The development of the age-related self-concept and the self-estimated performance of professional musicians in a lifespan perspective,2014,Musicae Scientiae,"Gembris, Heiner",Germany,Germany,Germany,NA,2536,NA,NA,NA,NA,,NA,musicians,NA,NA,NA,NA,NA,,Ramatally,"aging, lifespan development, music performance, professional musicians, self-concept, musical expertise"
I like the way it sounds: The influence of instrumentation on a pop song's place in the charts,2014,Musicae Scientiae,"Nunes, Joseph C. ",United States of America,United States of America,United States of America,NA,NA,NA,NA,NA,NA,,NA,M/A,NA,NA,Unclassified,Unclassified,precomposed,,Ramatally,"Billboard's Hot 100 charts, instrumentation, musical tastes, orchestration, popular music, popularity, timbre, music preferences, sound"
The arousing and cathartic effects of popular heartbreak songs as revealed in the physiological responses of listeners,2014,Musicae Scientiae,"Tsai, Chen-Gia",Taiwan,Taiwan,Taiwan,NA,39,22.5,1.6,18,21,,undergraduate ,musicians,compensation,NA,Mandarin songs,Taiwan,precomposed,,Ramatally,"finger temperature, music and emotion, relaxation, skin conductance, verse-chorus form"
The effect of music training on unimanual and bimanual responses,2014,Musicae Scientiae,"Chang, Xin",R.R. China,China,China,NA,20; 20; 20,20.7; 20.75; 21.45,1.02; 0.97; 1.04,NA,NA,,students,pianists; singers; non-musicians,compensation,14.05; 6.2; 0,NA,NA,NA,,Ramatally,"bimanual response, bimanual synchrony, music training, motor coordination, unimanual response, handedness, music performance"
A case study of scaling multiple parameters by the violin,2014,Musicae Scientiae,"Edgerton, Michael Edward",Malaysia,Malaysia,Malaysia,NA,1,NA,NA,NA,NA,,musicians,musician,NA,20,NA,NA,experiementer-created,,Ramatally,"acoustics, bow, desychronization, dynamical systems, multiple parameters, music composition, nonlinear phenomena, scaling, sound production, violin"
The Evaluation of Vocal Pitch Accuracy: The Case of Operatic Singing Voices,2014,Musicae Scientiae,"Larrouy-Maestri, Pauline",Belgium,Belgium,Belgium,NA,22,45.68,11.16,8,14,,professional musicians,musicians,NA,35.77,Western Opera,NA,precomposed,,Ramatally,"acoustical analyses,music experts, operatic technique, singing, intonation"
Memory Improvement While Hearing Music: Effects of Structural Continuity on Feature Binding,2014,Musicae Scientiae,"Dowling, W. Jay",United States of America,United States of America,NA,NA,44,24.8,NA,NA,NA,,undergraduate,NA,NA,NA,Classical,NA,precomposed,This paper had 8 experiements,Ramatally,"memory, music, binding, features, contour"
Memory Improvement While Hearing Music: Effects of Structural Continuity on Feature Binding,2014,Musicae Scientiae,"Dowling, W. Jay",United States of America,United States of America,NA,NA,26,NA,NA,NA,NA,,NA,NA,NA,NA,Classical,NA,"precomposed, experiementer-created",,Ramatally,"memory, music, binding, features, contour"
Memory Improvement While Hearing Music: Effects of Structural Continuity on Feature Binding,2014,Musicae Scientiae,"Dowling, W. Jay",United States of America,United States of America,NA,NA,37,NA,NA,NA,NA,,NA,NA,NA,NA,Classical,NA,"precomposed, experiementer-created",,Ramatally,"memory, music, binding, features, contour"
Memory Improvement While Hearing Music: Effects of Structural Continuity on Feature Binding,2014,Musicae Scientiae,"Dowling, W. Jay",United States of America,United States of America,NA,NA,20,NA,NA,NA,NA,,NA,NA,NA,NA,Classical,NA,"precomposed, experiementer-created",,Ramatally,"memory, music, binding, features, contour"
Memory Improvement While Hearing Music: Effects of Structural Continuity on Feature Binding,2014,Musicae Scientiae,"Dowling, W. Jay",United States of America,United States of America,NA,NA,35,NA,NA,NA,NA,,NA,NA,NA,NA,Classical,NA,"precomposed, experiementer-created",,Ramatally,"memory, music, binding, features, contour"
Memory Improvement While Hearing Music: Effects of Structural Continuity on Feature Binding,2014,Musicae Scientiae,"Dowling, W. Jay",United States of America,United States of America,NA,NA,70,NA,NA,NA,NA,,NA,NA,NA,NA,Classical,NA,"precomposed, experiementer-created",,Ramatally,"memory, music, binding, features, contour"
Memory Improvement While Hearing Music: Effects of Structural Continuity on Feature Binding,2014,Musicae Scientiae,"Dowling, W. Jay",United States of America,United States of America,NA,NA,31,NA,NA,NA,NA,,NA,NA,NA,NA,Classical,NA,"precomposed, experiementer-created",,Ramatally,"memory, music, binding, features, contour"
Memory Improvement While Hearing Music: Effects of Structural Continuity on Feature Binding,2014,Musicae Scientiae,"Dowling, W. Jay",United States of America,United States of America,NA,NA,40,NA,NA,NA,NA,,NA,NA,NA,NA,Classical,NA,"precomposed, experiementer-created",,Ramatally,"memory, music, binding, features, contour"
The Sound of Emotion: The Effect of Performers’ Experienced Emotions on Auditory Performance Characteristics,2014,Musicae Scientiae,"G. W. Van Zijl, Anemone",Finland,Finland,Finland,NA,8,24.3,1.8,8,0,,professional musicians; amateur musicians,musicians,NA,NA,Classical,United Kingdom,precomposed,,Ramatally,"audio analysis, felt emotion, expressive performance, emotional performance, performing music"
Performing Musical Dynamics: How Crucial are Musical Imagery and Auditory Feedback for Expert and Novice Musicians?,2014,Musicae Scientiae,"Bishop, Laura",Austria,NA,NA,NA,49,30.7; 22.2,10.1; 9.0,32,17,,professional musicians; amateur musicians,musicians,NA,11.9; 3.1,Western music,NA,other,Participants were in two groupings. Experiment material consist of scales,Ramatally,"musical imagery, auditory feedback, planning, musical expertise, expressive"
The Coupling of Action and Perception in Musical Meaning Formation,2014,Musicae Scientiae,"Maes, Pieter-Jan",Belgium,Belgium,Belgium,NA,18; 18,23.8; 24.6,3.7; 4.8,8; 8,10; 10,,students,musicians; non-musicians,NA,9.7; 0,Western music,German,precomposed,Participants were in two groupings ,Ramatally,"embodied music cognition, expressive gestures, action-perception coupling, musical metaphor, musical expressiveness"
Synchronous Sympathy at the Symphony: Conductor and Audience Accord,2014,Musicae Scientiae,"Nakra, Teresa Marrin ",United States of America,United States of America,United States of America,NA,32,32,NA,18,12,,audience,NA,NA,3.7,Classical,Austrian,precomposed,"emotional responses to music, heart rate, slider box, affective symphony, wearable sensing",Ramatally,
Age and Musical Expertise Influence Emotion Recognition in Music,2014,Musicae Scientiae,"Castro, Sao Luis",Portugal,NA,NA,NA,80,22.7; 47; 23.4; 48.4,2.8; 4; 3.6; 4.8 ,40,40,,NA ,musicians; non-musicians,NA,0; 0; 11.3; 12.6,NA,NA,precomposed,"Participants were in 4 groups non-musicians (younger), non-musicians (older), musicians (younger), musicians (older). It was not clear if 10 women were in each group or if 10 women existed in the study.",Ramatally,
"Polyphonic Voice Multiplicity, Numerosity, and Musical Emotion Perception",2014,Musicae Scientiae,"Broze, Yuri",United States of America,United States of America,NA,NA,28,NA,NA,17,11,,undergraduate,NA,course credit,NA,Classical,NA,precomposed,This paper had 3 experiements,Ramatally,"musical emotion, musical voices, multiplicity, numerosity, denumberability, loneliness, Well-Tempered Clavier"
"Polyphonic Voice Multiplicity, Numerosity, and Musical Emotion Perception",2014,Musicae Scientiae,"Broze, Yuri",United States of America,United States of America,NA,NA,37,20,NA,NA,NA,,undergraduate,musicians,course credit,NA,Classical,NA,precomposed,,Ramatally,"musical emotion, musical voices, multiplicity, numerosity, denumberability, loneliness, Well-Tempered Clavier"
"Polyphonic Voice Multiplicity, Numerosity, and Musical Emotion Perception",2014,Musicae Scientiae,"Broze, Yuri",United States of America,United States of America,NA,NA,24,20,NA,10,14,,undergraduate,NA,course credit,NA,Classical ,NA,precomposed,,Ramatally,"musical emotion, musical voices, multiplicity, numerosity, denumberability, loneliness, Well-Tempered Clavier"
Mode of Presentation Affects Infants’ Preferential Attention to Singing and Speech,2014,Musicae Scientiae,"Costa-Giomi, Eugenia",United States of America,United States of America,United States of America,NA,12,344,NA,6,6,,infants,NA,NA,NA,Folk song,Canada,precomposed,This paper had 3 experiments. Mean age is in days,Ramatally,"auditory development, music, singing, speech, multimodal perception"
Mode of Presentation Affects Infants’ Preferential Attention to Singing and Speech,2014,Musicae Scientiae,"Costa-Giomi, Eugenia",United States of America,United States of America,United States of America,NA,12,339,NA,6,6,,infants,NA,NA,NA,Folk song,Canada,precomposed,,Ramatally,"auditory development, music, singing, speech, multimodal perception"
Mode of Presentation Affects Infants’ Preferential Attention to Singing and Speech,2014,Musicae Scientiae,"Costa-Giomi, Eugenia",United States of America,United States of America,United States of America,NA,24,347,NA,12,12,,infants,NA,NA,NA,Folk song,Canada,precomposed,,Ramatally,"auditory development, music, singing, speech, multimodal perception"
Musical Emotions Predicted by Feelings of Entrainment,2014,Musicae Scientiae,"Labbe, Carolina",Switzerland,Switzerland,Switzerland,NA,61; 38,23.6; 23.4,4.8; 5.6,119,0,,students ,NA,NA,NA,Classical ,NA,precomposed,,Ramatally,"music, emotion, rhythm, entrainment, questionnaire"
Absolute Judgment of Musical Interval Width,2014,Musicae Scientiae,"Aruffo, Christopher",Canada,Canada,Canada,NA,41,22.14,NA,20,21,,students,NA,compensated,NA,Artificial,NA,experimenter-created,,Ramatally,"absolute pitch, relative pitch, categorical perception, music perception, music cognition"
"Effects of Polyphonic Context, Instrumentation, and Metrical Location on Syncopation in Music",2014,Musicae Scientiae,"Witek, Maria A. G. ",United Kingdom,United Kingdom,United Kingdom,NA,29,24.75,3.32,12,17,,students,musicians; non-musicians,voluntary,NA,Artificial,NA,experimenter-created,,Ramatally,"syncopation, rhythm, meter, polyphony, instrumentation"
Affective constraints on acquisition of musical concepts: Children’s and adults’ development of the major–minor distinction,2014,Musicae Scientiae,"Thompson, Clarissa A.",United States of America,United States of America,NA,NA,64,20.25,2.29,34,30,,adult,NA,NA,NA,NA,Western,experiementer-created,Study consisted of 2 experiements. Both experiements had material consistingof scales and unclassified melody,Ramatally,"constraints, development, learning, major–minor distinction, microgenetic method, musical cognition"
Affective constraints on acquisition of musical concepts: Children’s and adults’ development of the major–minor distinction,2014,Musicae Scientiae,"Thompson, Clarissa A.",United States of America,United States of America,NA,NA,64; 64; 48,19.32; 10.25; 5.7,1.41; 0.54; 0.49,36; 36; 28,28; 28; 20,,adult; children,NA,NA,NA ,NA,Western,experiementer-created,,Ramatally,"constraints, development, learning, major–minor distinction, microgenetic method, musical cognition"
Congruency between instrumental background music and behavior on a website,2014,Musicae Scientiae,"Gueguen, Nicolas",France,France,France,NA,120,18.9,0.9,73,47,,undergraduate,NA,volunteer,NA,Jazz; Djembe music,NA,precomposed,,Ramatally,"congruence, consumer’s decision, influence, music, website"
Seeking professional fulfillment: US symphony orchestra members in schools,2014,Musicae Scientiae,"Abeles, Harold",United States of America,United States of America,United States of America,NA,47,NA,NA,16,31,,musicians,musicians,NA,NA,NA,NA,NA,,Ramatally,"artistic integrity, community service, creativity, education programs, job satisfaction, orchestra musicians, social responsibility"
Music and felt emotions: How systematic pitch level variations affect the experience of pleasantness and arousal,2014,Musicae Scientiae,"Jaquet, Lucas",Switzerland,Switzerland,Switzerland,NA,49,23.3,NA,25,24,,undergraduate,NA,compensated,NA,Classical,Western,precomposed,,Ramatally,"emotion, valence, arousal, pitch level, gender differences"
"The influence of stress, optimism, and music training on music uses and preferences",2014,Musicae Scientiae,"Getz, Laura M.",United States of America,United States of America,United States of America,Caucasian,154,18.95,0.96,124,30,,undergraduate,NA,NA,NA,NA,NA,NA,,Ramatally,"music preferences, music training, music uses, optimism, stress"
A longitudinal study of the process of acquiring absolute pitch: A practical report of training with the ‘chord identification method’,2014,Musicae Scientiae,"Sakakibara, Ayako",Japan,Japan,Japan,NA,24,NA,NA,17,7,,children,NA,NA,NA,NA,NA,NA,,Ramatally,"absolute pitch, chord identification, training to acquire absolute pitch"
Listeners as spectators? Audio-visual integration improves music performer identification,2014,Musicae Scientiae,"Mitchell, Helen F.",Australia,Australia; United Kingdom,NA,NA,50,27,NA,NA,NA,,student,musicians,NA,NA,Jazz,NA,experiementer-created,,Ramatally,"audiovisual integration, auditory recognition, music perception, music performance, visual recognition"
Listeners as spectators? Audio-visual integration improves music performer identification,2014,Musicae Scientiae,"Mitchell, Helen F.",Australia,Australia,NA,NA,20,34,NA,NA,NA,,undergraduate; postgraduate,NA,volunteer,NA,Jazz,NA,experiementer-created,,Ramatally,"audiovisual integration, auditory recognition, music perception, music performance, visual recognition"
"The older, the wiser? Profiles of string instrument teachers with different experience according to their conceptions of teaching, learning, and evaluation",2014,Musicae Scientiae,"Lopez-Iniguez, Guadalupe",Spain,Spain,Spain,NA,53,36.94,6.95,31,22,,teachers,musicians,NA,NA,NA,NA,NA,,Ramatally,"conceptual change, conceptions of teaching, learning, evaluation, constructivism, music conservatories, teaching experience, string instrument teachers"
Developing identities using music technology in therapeutic settings,2014,Musicae Scientiae,"Burland, Karen",United Kingdom,United Kingdom,United Kingdom,NA,6,NA,NA,4,2,,music therapists,NA,NA,NA,NA,NA,NA,,Ramatally,"identity construction, motivation, repairing identities, social identity"
Music and language: Do they draw on similar syntactic working memory resources?,2014,Musicae Scientiae,"Fiveash, Anna",Australia,Australia,Australia,NA,61,22.6,NA,NA,NA,,NA,musicians; non-musicians,NA,NA,Artificial,NA,experiementer-created,,Ramatally,"memory, musicians, phonological loop, shared syntactic integration resource hypothesis, syntax"
Psychological well-being in professional orchestral musicians in Australia: A descriptive population study,2014,Musicae Scientiae,"Kenny, Dianna T.",Australia,Australia,Australia,NA,377,42.1,10.3,192,184,,musicians,musicians,NA,NA,NA,NA,NA,,Ramatally,"anxiety, depression, music performance anxiety, professional orchestral musicians, psychosocial well-being"
The effect of subtitles on listeners’ perceptions of expressivity,2014,Musicae Scientiae,"Silveira, Jason M.",United States of America,United States of America,United States of America,NA,103,NA,NA,NA,NA,,undergraduate; postgraduate,NA,NA,NA ,Classical,Western,precomposed,,Ramatally,"CRDI, expressivity, focus of attention, perceptions, subtitles"
Looking at the (mis) fortunes of others while listening to music,2014,Musicae Scientiae,"Arriaga, Patricia",Portugal,Portugal,Portugal,NA,65,24.9,2.91,36,27,,NA,NA,volunteer,NA,Classical,Western,precomposed,,Ramatally,"emotions, eye movements, intermodal perception, music, visual attention"
The psychological benefits of participating in group singing for members of the general public,2014,Musicae Scientiae,"Judd, Marianne",Australia,Australia,Australia,NA,10,54,NA,6,4,,singers,musicians,NA,NA,NA,NA,NA,,Ramatally,"choirs, general public, group singing, wellbeing"
Does music training enhance working memory performance? Findings from a quasi-experimental longitudinal study,2014,Musicae Scientiae,"Roden, Ingo",Germany,Germany,Germany,NA,50,NA,NA,27,23,,children,NA,NA,NA,NA,NA,NA,,Ramatally,"central executive, cognitive development, instrumental music training, phonological loop, visuospatial sketchpad, working memory"
In pursuit of harmony: The social and organisational factors in a professional vocal ensemble,2014,Musicae Scientiae,"Chern Lim, Mei",United Kingdom,United Kingdom,United Kingdom,NA,8,NA,NA,4,4,,singers,musicians,NA,NA,NA,NA,NA,,Ramatally,"chamber music, collaboration, group dynamics, professional ensembles, team effectiveness, work groups"
Music-induced analgesia in chronic pain: Efficacy and assessment through a primary-task paradigm,2014,Musicae Scientiae,"Finlay, Katherine A.",United Kingdom,United Kingdom,United Kingdom,NA,23,48.4,14.43,21,2,,NA,NA,NA,NA,Jazz,Western,precomposed,,Ramatally,"attention, audio-analgesia, chronic pain, distraction, music-induced analgesia, visual search"
"Changes in self-efficacy beliefs over time: Contextual influences of gender, rank-based placement, and social support in a competitive orchestra environment",2014,Musicae Scientiae,"Hendricks, Karin S.",United States of America,United States of America,United States of America,NA,157,NA,NA,68,89,,students,musicians,NA,NA,NA,NA,NA,,Ramatally,"competition, orchestra, social support, sources of self-efficacy"
Learning to discern and account: The trajectory of a listening skill in an institutional setting,2014,Musicae Scientiae,"Wallerstedt, Cecilia",Sweden,Sweden,Sweden,NA,27,NA,NA,12,15,,children,NA,NA,NA,Swedish congratulations songgs; classical; contemporary,NA,precomposed,Swedish congratulations song was considered a 'genre' in this study,Ramatally,"cultural tools, development, listening, metre, sociocultural"
Music motivation and the effect of writing music: A comparison of pianists and guitarists,2014,Musicae Scientiae,"MacIntyre, Peter D.",Canada,Canada,Canada,NA,599,NA,NA,162,432,,musicians,NA,NA,NA,NA,NA,NA,,Ramatally,"autonomy, competence, intrinsic, motivation, musical self, relatedness, self-determination, writing music"
Psychological and physiological effects of singing in a choir,2014,Musicae Scientiae,"Muhip Sanal, Ahmet",Turkey,Turkey,Turkey,NA,70,21,NA,48,22,,students,musicians,NA,NA,Folk song,Turkey,precomposed,,Ramatally,"amylase, anxiety, choir, negative affect, positive affect"
"Scaffolding, organizational structure and interpersonal interaction in musical activities with older people",2014,Musicae Scientiae,"Creech, Andrea",United Kingdom,United Kingdom,United Kingdom,White,398,NA,NA,NA,NA,,NA,musicians; non-musicians,NA,NA,Unclassified,Unclassified,precomposed,Study consisted of musical group activities however did not elicitly state what type of music was involved,Ramatally,"community music, facilitators, older learners, organisational structure, scaffolding"
Investigating the influence of musical training on cross-modal correspondences and sensorimotor skills in a real-time drawing paradigm,2014,Musicae Scientiae,"Kussner, Mats B.",United Kingdom,United Kingdom,United Kingdom,NA,73,28.51,7.71,42,31,,undergraduate; postgraduate; staff,NA,NA,NA,Artificial; Classical,Western,semi-precomposed,,Ramatally,"cross-modal correspondences, musical training, real-time drawing, sensorimotor skills, time perception"
Da capo: A musical technique to evoke narrative recall,2014,Musicae Scientiae,"Pilcher, Nick",United Kingdom,United Kingdom,United Kingdom,Chinese,15,NA,NA,5,10,,students,NA,NA,NA,Classical,Western,precomposed,,Ramatally,"Chinese, interviewing, music, narratives, students"
The contributions of compositional structure and performance expression to the communication of emotion in music,2014,Musicae Scientiae,"Quinto, Lena",Australia,Australia,Australia,NA,8,27.63,9.08,NA,NA,,musicians,musicians,NA,15,NA,NA,other,,Ramatally,"acoustic cues, composition, emotion perception, music cognition, performance expression"
How music changes our lives: A qualitative study of the long-term effects of intense musical experiences,2014,Musicae Scientiae,"Schafer, Thomas",Germany,Germany,Germany,NA,13,37.3,NA,7,6,,NA,NA,NA,NA,NA,NA,NA,,Ramatally,"altered states of consciousness, grounded theory, intense experiences, peak experiences, spirituality"
Learning to make music in older adulthood: A mixed-methods exploration of impacts on wellbeing,2014,Musicae Scientiae,"Perkins, Rose",United Kingdom,United Kingdom,NA,NA,98,67.87,8.76,74,22,,adult,NA,NA,NA,NA,NA,other,,Ramatally,"health promotion, mixed-methods, music learning, older adults, subjective wellbeing"
Learning to make music in older adulthood: A mixed-methods exploration of impacts on wellbeing,2014,Musicae Scientiae,"Perkins, Rose",United Kingdom,United Kingdom,NA,NA,21,64.38,NA,NA,NA,,adult,NA,NA,NA,NA,NA,other,,Ramatally,"health promotion, mixed-methods, music learning, older adults, subjective wellbeing"
Frightened by the stage or by the public? Exploring the multidimensionality of music performance anxiety,2014,Musicae Scientiae,"Sarbescu, Paul",Romania,Romania,Romania,NA,134,16.41,1.21,89,45,,students,musicians,NA,6.02,NA,NA,NA,,Ramatally,"five-factor model, multidimensionality, music performance anxiety, personality"
Perception of a tonal hierarchy derived from Korean music,2014,Musicae Scientiae,"Lantz, Michael E.",United States of America,United States of America,United States of America; Korea,NA,12; 12,22.1; 23.3,3.4; 3.5,9; 9,3; 3,,NA,NA,compensated; course credit,NA,Korean Music,Korea,semi-precomposed,Experiments consisted of two groups: Western-familiar listeners and Korean-familiar listeners,Ramatally,"cross cultural, duration, pitch structure, probe-tone technique, tonal hierarchy"
Perception of a tonal hierarchy derived from Korean music,2014,Musicae Scientiae,"Lantz, Michael E.",United States of America,United States of America,United States of America; Korea,NA,12; 12,21.8; 22.2,2.9; 2.6,6; 11,6; 1,,NA,NA,compensated; course credit,NA,Korean Music,Korea,semi-precomposed,,Ramatally,"cross cultural, duration, pitch structure, probe-tone technique, tonal hierarchy"
What makes music emotionally significant? Exploring the underlying mechanisms,2014,Musicae Scientiae,"Juslin, Patrik N.",Sweden,Sweden,Sweden,NA,20,28,NA,10,10,,students,NA,compensated; course credit,NA,Classical,Western,precomposed,,Ramatally,"affect, expectancy, listening, psychophysiology, theory"
Performance anxiety in adolescent musicians,2014,Musicae Scientiae,"Thomas, Jason P.",Australia,Australia,Australia,NA,90,15.1,1.25,49,41,,students,musicians,volunteer,NA,NA,NA,NA,,Ramatally,"coping, Music Performance Anxiety Inventory for Adolescents, personality, sex differences, trait anxiety"
Pleasure generated by sadness: Effect of sad lyrics on the emotions induced by happy music,2014,Musicae Scientiae,"Mori, Kazuma",Japan,Japan,Japan,NA ,53,22.55,1.97,30,23,,students,NA,NA,NA,Pop; Rock,NA,precomposed,,Ramatally,"emotion, happy, lyrics, music, pleasure, sadness"
Experiencing earworms: An interview study of Involuntary Musical Imagery,2014,Musicae Scientiae,Williamson. Victoria J.,United Kingdom,United Kingdom,United Kingdom,NA,6,42.6,NA,3,3,,NA,NA,NA,NA,NA,NA,NA,,Ramatally,"auditory imagery, earworms, Involuntary Musical Imagery, grounded theory, musical experience"
Emotion regulation strategy mediates both positive and negative relationships between music uses and well-being,2014,Musicae Scientiae,"Chin, TanChayuan",Australia,Australia,Australia,NA,637,23.93,5.82,493,144,,students,musicians,NA,NA,NA,NA,NA,,Ramatally,"emotion regulation, reappraisal, suppression, music engagement, well-being"
Tempo and intensity of pre-task music modulate neural activity during reactive task performance,2014,Musicae Scientiae,"Bishop, Daniel T. ",United Kingdom,United Kingdom,United Kingdom,White,12,21.2,3,6,6,,athletes,NA,NA,NA,Pop,Western,precomposed,,Ramatally,"affect, basal ganglia, emotion, fMRI, sport"
Background music can aid second language learning,2014,Musicae Scientiae,"Kang, Hi Jee",United Kingdom,United Kingdom,NA,NA,16; 16,22.94; 27.13,NA,20,12,,NA,NA,paid,NA,Unclassified,Unclassified,other,,Ramatally,"background music, musicality, second language learning, tonal language, verbal memory"
Metacognitive judgments in music performance,2014,Musicae Scientiae,"Peynircioglu, Zehra F.",United States of America,United States of America,United States of America,NA,18,NA,NA,NA,NA,,university students,musicians,course credit; volunteers,NA,NA,Western,precomposed,This study consisted of 3 experiments,Ramatally,"metacognition, ease of learning, judgment of learning, music performance, music"
Metacognitive judgments in music performance,2014,Musicae Scientiae,"Peynircioglu, Zehra F.",United States of America,United States of America,United States of America,NA,22,NA,NA,NA,NA,,university students,musicians,course credit; volunteers,NA,NA,Western,precomposed,,Ramatally,"metacognition, ease of learning, judgment of learning, music performance, music"
