PaperTitle,Year,Journal,FirstAuthorName,FirstAuthorCountry,CountryDataCollected,SamplePrimaryCountryofOrigin,Ethnicity,SampleSize,SampleAgeMean,SampleAgeSD,FemaleParticipantsNumber,MaleParticipantsNumber,,SampleOtherDescription,SampleMusicianshipDescription,SamplingMethodDescription,MeanYearsEducation,MusicPrimaryGenre,MusicOriginCountry,MusicSource,Comments,CoderName,Keywords
Music listening evokes implicit affiliation,2017,Musicae Scientiae,"Vuoskoski, Jonna K.",UK,UK,UK,White,61,24.07,5.78,37,NA,,36 musically trained participants; 4 self-taught musicians; the participants were split into 2 groups.,Musicians; non-musicians,Volunteers,NA,Popular music,India; West Africa,Precomposed,The songs were sung in a language unfammiliar to participants,Akvile Jadzgeviciute,Affiliation; empathy; Implicit Association Test; music listening; social bonding
The effect of ensemble and solo performance on affective experiences induced by music,2017,Musicae Scientiae,"Labbe, Carolina",Switzerland,Switzerland,Switzerland,NA,144,22.74,5.13,112,28,,,85 musicallly trained,Volunteers,NA,Classical,Western,Precomposed,Music stimuli were recorded for the EU SIEMPRE project,Akvile Jadzgeviciute,Emotion; entrainment; performance; quartet; self report; structure; texture
Confidence and choral configuration: The affective impact of situational and acoustic factors in amateur choirs,2017,Musicae Scientiae,"Bonshor, Michael J.",UK,UK,NA,NA,18; 16,NA,NA,12; 8,6; 8,,group interview; individual interview.,Musicians,Volunteers,NA,NA ,NA,NA,"Age was provided in ranges, with the majority (14) falling in the 61-70 bracket.",Akvile Jadzgeviciute,Amateurs; choirs; choral; confidence; configuration; singers
Broadcasting personalities: The relationship between occupation and music preferences in the BBC Radio programme Desert Island Discs,2017,Musicae Scientiae,"Knox, Don",UK,NA,NA,NA,2584; 2611,NA,NA,NA,NA,,NA,NA,Other,NA,NA ,NA,NA,"Data was obtained from Dessert Island Discs archive, BBC and no demopgraphic information was provided on the article.",Akvile Jadzgeviciute,Desert Island Discs; music attributes; music preferences; personality; RIASEC
"Long-term representations of melodies in Western listeners: Influences of familiarity, musical expertise, tempo and structure",2017,Musicae Scientiae,"Budenbender, Niklas ",Germany,Germany,NA,NA,63,27.7,10.49,36,27,,NA,Musicians; non-musicians,Volunteers,NA,artificial,NA,experimenter-created,,Akvile Jadzgeviciute,Expertise; familiarity; identification; melody; motive boundaries; tempo
Development of musical abilities: Cross-sectional computer-based assessments in educational contexts,2017,Musicae Scientiae,"Asztalos, Kata ",Hungary,online,Hungary,NA,2961,13.03,3.03,NA,NA,,School grade and school with/without musical programmes,NA,Other,NA,NA ,NA,NA,Participants were recruited from schools in Hungary,Akvile Jadzgeviciute,Computer-based assessment; cross-sectional measurement; diagnostic evaluation; musical perception; school assessment
A new research method to test auditory preferences in young listeners: Results from a consonance versus dissonance perception study,2017,Musicae Scientiae,"Di Stefano, Nicola",Italy,NA,NA,NA,22,30 months,6 months,13,9,,Children,NA,Volunteers,NA,NA ,NA,NA,Music stimuli used were consonant and disonant intervals from a previous study,Akvile Jadzgeviciute,Behavioural methods; children; consonance and dissonance perception; embodiment; musical toy; toddlers
The higher the pitch the larger its crossmodal influence on visuospatial processing,2017,Musicae Scientiae,"Fernandez-Prieto, Irune",Spain,NA,NA,NA,16,21.5,NA,12,NA,,"Right handed, normal hearing",non-musicians,paid,NA,NA ,NA,NA,,Akvile Jadzgeviciute,Auditory perception; auditory pitch; crossmodal correspondences; spatial encoding of pitch; visuospatial attention
"Music, ballet, mindfulness, and psychological inflexibility",2017,Musicae Scientiae,"Serrano, Telmo",Portugal,Portugal,Portugal,NA,113,11.68,1.92,73,40,,"Musical trainig, ballet dancers training, non-musicians",Musicians; non-musicians,Other,6.16,NA ,NA,NA,,Akvile Jadzgeviciute,Ballet; cognitive fusion; experiential avoidance; mindfulness; music; psychological inflexibility
Self-regulation of teenaged pianists during at-home practice,2017,Musicae Scientiae,"Pike, Pamela D.",USA,USA,NA,NA,9,Oct-16,NA,NA,NA,,NA,NA,Volunteers,NA,NA,NA,NA,The study invesitgated practicing strategies in a population of teenage pianists ,Akvile Jadzgeviciute,Deliberate practice; motivation; practice autonomy; practice strategies; self-regulation; teenaged students
Associating emotions with Wagner’s music: A developmental perspective,2017,Musicae Scientiae,"Andrade, Paulo E. ",Canada,Brazil,Brazil,NA,29; 57; 54; 55,"7,7; 8,6; 9,5; 10,5","03; 0,3; 0,3; 0,3",8; 30; 31; 28,NA,,Children,NA,Volunteers,NA,Classical,Western,Precomposed,Experiment 1; The studie's population was reported in a broken down way due to comparative analysis between child and adult raters,Akvile Jadzgeviciute,Arousal; development; emotion; music; valence
Associating emotions with Wagner’s music: A developmental perspective,2017,Musicae Scientiae,"Andrade, Paulo E. ",Canada,Brazil,Brazil,NA,57; 51 ,"23,1; 27,6","6,7; 7,3",24; 41,NA,,Adults,Musicians; nonmusicians,Volunteers,NA,Classical,Western,Precomposed,Experiment 2,Akvile Jadzgeviciute,Arousal; development; emotion; music; valence
Music self-concept and self-esteem formation in adolescence: A comparison between individual and normative models of importance within a latent framework,2017,Musicae Scientiae,"Scalas, L. Francesca",Italy,NA,NA,NA,512,13.16,0.706,311,201,,NA,Musicians; non-musicians,,NA,NA ,NA,NA,,Akvile Jadzgeviciute,Importance; latent interactions; music self-concept; normative; weighted average
An interpretative phenomenological analysis of the lived musical experiences of three Williams syndrome individuals,2017,Musicae Scientiae,"Erasmus, Ewie",South Africa,NA,NA,NA,3,NA,NA,0,3,,Williams syndrome,NA,Other,NA,NA ,NA,NA,Lived musical experiences were explored through interviews,Akvile Jadzgeviciute,Interpretative phenomenological analysis; lived musical experiences; wellbeing; Williams syndrome
Effects of preferred relaxing music after acute stress exposure: A randomized controlled trial,2017,Musicae Scientiae,"Torre-Luque, Alejandro de la",Spain,Spain,NA,NA,30; 28,"21,67; 21,82","2,99; 3,50",NA,18; 10,,Control group; Experimental group,non-musicians,Other,NA,NA ,NA,NA,STOMP was used to evaluate music preference; music condition had the participants pick relaxing music,Akvile Jadzgeviciute,Acute stress; gender; heart rate variability; preferred music; recovery; sample entropy
Investigating the influence of music training on verbal memory,2017,Musicae Scientiae,"Taylor, Alexandra C.",UK,NA,NA,NA,20; 20,"21,50; 21,85","2,54; 2,98",9; 9,11; 11,,NA,Musicians; non-musicians,Volunteers,NA,NA ,NA,NA,,Akvile Jadzgeviciute,Cognition; expertise; music training; short-term memory verbal memory
Minding the Body: An interdisciplinary theory of optimal posture for musicians,2017,Musicae Scientiae,"Shoebridge, Ann",Australia,NA,NA,NA,10,30-64 y,NA,NA,NA,,"Professionals recruited from music educators, physiotherapists, and Aleander Technique teachers",NA,Other,NA,NA,NA,NA,,Akvile Jadzgeviciute,Health; interdisciplinary; musicians; playing-related problems; performance; posture
The expression of music throughout the lives of expectant parents,2017,Musicae Scientiae,"Dayton, Carolyn J. ",USA,USA,NA,Black,102,27.4,6.5,51,51,,Expectant parents,NA,Other,NA,NA,NA,NA,"Quote: the current sample is considered to be at relatively high risk due, in part, to high rates of unemployment, low rates of marriage, and personal income that is sufficiently low such that 49% of parents are living below the US federal poverty line.",Akvile Jadzgeviciute,Everyday life; functions of music; infancy; parents; self regulation; singing; trauma
The effects of a short-term music program on preschool children’s executive functions,2017,Musicae Scientiae,"Bugos, Jennifer A.",USA,USA,NA,Other (Hispanic),36,4y 9m - 5y 8m,NA,20,16,,12 kids spoke Spanish as their first language,NA,Other,NA,NA ,NA,NA,Study used music as a condition to evaluate it's influence on the development of executive function in pre-schoolers,Akvile Jadzgeviciute,Early childhood; executive functions; inhibition; music training
Music performance anxiety in ensemble rehearsals and concerts: A comparison of music and non-music major undergraduate musicians,2017,Musicae Scientiae,"Robson, Kim E.",USA,USA,NA,NA,108; 166,"20,58; 19,92","1,85; 1,29",54; 93,54; 73,,Undergradutae music majors; Undergraduate non-music majors,Musicians,Other,NA,NA ,NA,NA,"Study recruited participants from bands in various higher education institutions, 2 institutions were listed as ""historically black""",Akvile Jadzgeviciute,Concerts; depression; ensemble performance; music performance anxiety; non-music major undergraduates; rehearsals; self-efficacy
Facing pitch: Constructing associations between space and pitch leads to better estimation of musical intervals,2017,Musicae Scientiae,"Loudwin, Johannes",Germany,NA,NA,NA,40,20.95,2.4,33,7,,NA,NA,Other,NA,NA ,NA,experimenter-created,Experiment 1; Study used intevals as musical stimuli,Akvile Jadzgeviciute,Cognitive representation; ear training; intermodal perception; musical pitch; SMARC; visualization
Facing pitch: Constructing associations between space and pitch leads to better estimation of musical intervals,2017,Musicae Scientiae,"Loudwin, Johannes",Germany,NA,NA,NA,34,22.12,4.04,23,11,,NA,NA,Other,NA,NA ,NA,experimenter-created,Experiment 2; Study used intevals as musical stimuli,Akvile Jadzgeviciute,Cognitive representation; ear training; intermodal perception; musical pitch; SMARC; visualization
Acoustic Gestalt: On the perceptibility of melodic symmetry,2017,Musicae Scientiae,"Mongoven, Casey",USA,USA,NA,NA,28,35.3,19.3,10,18,,,Musicians; non-musicians,Volunteers,NA,artificial,NA,experimenter-created,Experiment utilised sonifications generated by a computer programme .,Akvile Jadzgeviciute,Acoustic Gestalt; aesthetic appreciation; empirical aesthetics; melody; music; perception; symmetry
Alternative music playlists on the radio: Flow experience and appraisal during the reception of music radio programs,2017,Musicae Scientiae,"Ruth, Nicolas",Germany,Germany,NA,NA,120,33.64,3.07,61,59,,Participants recruited for the study were between 30-40 years old,NA,paid,NA,NA ,Western,Precomposed,"Experiment 1; Participants were split into groups, but their demographics were reported separately, apart from Age SD. The music used was all western popular music, but the primary genre was not specified.",Akvile Jadzgeviciute,Broadcasting; flow; listening modes; musical skill; music preference; music program; radio
Alternative music playlists on the radio: Flow experience and appraisal during the reception of music radio programs,2017,Musicae Scientiae,"Ruth, Nicolas",Germany,Germany,NA,NA,217,21.87,3.9,107,110,,Participants recruited for the study were between 14-31 years old,NA,paid,NA,NA ,Western,Precomposed,Experiment 2; Study used intevals as musical stimuli,Akvile Jadzgeviciute,Broadcasting; flow; listening modes; musical skill; music preference; music program; radio
Parent perceptions of music therapy in an on-campus clinic for children with Autism Spectrum Disorder,2017,Musicae Scientiae,"Schwartzberg, Edward T.",USA,NA,NA,NA,4,NA,NA,4,0,,Participants had children with ASD who received music therapy at OC-MTC,NA,Volunteers,NA,NA ,NA,NA,,Akvile Jadzgeviciute,Autism; music therapy; parents; parents’ perceptions; treatment interventions
Koechlin’s volume: Perception of sound extensity among instrument timbres from different families,2017,Musicae Scientiae,"Chiasson, Frederic",Canada,NA,NA,NA,80,NA,NA,NA,NA,,Anglophones; francophones,NA,NA,NA,artificial,NA,experimenter-created,"Stimuli were samples of orchestral instrument recordings; no participant demographics were reported; 2 experiments were run, all the participants and stimuli were the same per both experiments.",Akvile Jadzgeviciute,Auditory size; extensity; Koechlin; largeness; orchestration; timbre; volume
Efficacy of a short-term intense piano training program for cognitive aging: A pilot study,2017,Musicae Scientiae,"Bugos, Jennifer A.",USA,NA,NA,NA,34,70.79,6.2,28,6,,Less than 3 years of formal musical training,NA,NA,16.63,NA ,NA,NA,Piano training programme was evaluated in this paper.,Akvile Jadzgeviciute,Executive functions; music training; piano training; processing speed; verbal fluency
Smoke into Sound: A pilot randomised controlled trial of a music cravings management program for chronic smokers attempting to quit,2017,Musicae Scientiae,"Dingle, Genevieve A.",Australia,Australia,NA,NA,19; 18; 18; 55,"40,37; 40,72; 41,39; 40,61","9,64; 11,02; 12,73; 10,99",7; 12; 6; 25,12; 6; 12; 30,,Smokers,NA,Volunteers,NA,NA ,NA,NA ,Participants in certain conditions of the experiment had to compile a quitting playlist to aid them to quit smoking.,Akvile Jadzgeviciute,Craving; health; intervention; music-listening; smoking
Comparison of well-being of older adult choir singers and the general population in Finland: A case-control study,2017,Musicae Scientiae,"Johnson, Julene K.",USA,Finland,NA,NA,109; 307,"71,3; 68,8","7,2; 6,6",39; 83,70; 224,,"Choir sample; control group (non recruited, data extrated from a database)",musicians,Volunteers; other,NA,NA ,NA,,The control group was case matched to the population investigated and data was obtained from a separate database with record of the same questionnaires.,Akvile Jadzgeviciute,Arts; case-control methods; choir; health promotion; music; older adults; quality of life; singing
Testing the beneficial effects of singing in a choir on mood and stress in a longitudinal study: The role of social contacts,2017,Musicae Scientiae,"Linnemann, Alexandra",Germany,NA,NA,NA,44,22.98,2.18,NA,NA,,Choir singers,NA,Volunteers; other,NA,NA ,NA ,NA ,,Akvile Jadzgeviciute,Choir; health; longitudinal; mood; singing; social contacts; social network map; stress; transfer effects
Health status and preventive health behavior of music students during university education: Merging prior results with new insights from a German multicenter study,2017,Musicae Scientiae,"Spahn, Claudia ",Germany,Germany,NA,NA,288; 142; 75,NA,NA,173; 81; 56,NA,,"first, second and third survey of the same population",Musicians,volunteers,NA,NA ,NA ,NA ,,Akvile Jadzgeviciute,Health; health-oriented preventive behavior; musicians’ medicine; music physiology; music students; playing-related health problems; prevention program
Why go to pop concerts? The motivations behind live music attendance,2017,Musicae Scientiae,"Brown, Steven Caldwell",UK,online,UK,NA,249,26.49,NA,137,112,,NA,NA,Volunteers,NA,NA ,NA ,NA,Motivations behind going to live pop music concerts were explored.,Akvile Jadzgeviciute,Consumer behaviour; live music; music piracy; music preferences; thematic analysis
Similar but different: Interviewing monozygotic twins discordant for musical practice,2017,Musicae Scientiae,"Eriksson, Helene ",Sweden,online,Sweden,NA,1312,37.4,6,NA,NA,,twins; online survey,"musicians, non-musicians",Paid,NA,NA ,NA ,NA ,"Participants were described as not professionla musicians, but half of them (1 per twin pair) were expected to play a keyboard instrument, while the other one did not.",Akvile Jadzgeviciute,Flow; motivation; music practice; openness; personality
Similar but different: Interviewing monozygotic twins discordant for musical practice,2017,Musicae Scientiae,"Eriksson, Helene ",Sweden,Sweden,Sweden,NA,20,31 - 47,NA,12,8,,twins; interview population extracted from the survey population,"musicians, non-musicians",Paid,NA,NA ,NA ,NA ,"Participants were described as not professionla musicians, but half of them (1 per twin pair) were expected to play a keyboard instrument, while the other one did not.",Akvile Jadzgeviciute,Flow; motivation; music practice; openness; personality
Cognitive inhibitory control in children following early childhood music education,2017,Musicae Scientiae,"Joret, Marie-Eve",Belgium,Belgium,NA,NA,32; 31,"10,44; 10.44","0,51; 0.56",11; 17,21; 14,,Children,musicians; non-musicians,Volunteers; (paid in sweets after each task),NA,NA,NA,NA,,Akvile Jadzgeviciute,Early childhood music education; executive functions; inhibitory control; music training
Instrumental practice in the contemporary music academy: A three-phase cycle of Self-Regulated Learning in music students,2017,Musicae Scientiae,"Hatfield, Johannes L.",Norway,Norway,NA,NA,204,NA,NA,96,108,,"Primary instrument - piano (26,8%); music performance students (52,5%); undergraduate level of study (67,9%)",musicians,Volunteers,NA,NA,NA,NA,Participants' poractice was inestigated through self-report,Akvile Jadzgeviciute,Goal setting; instrumental practice; motivation; psychological skills; self-regulated learning
Age trends in musical preferences in adulthood: 1. Conceptualization and empirical investigation,2017,Musicae Scientiae,"Bonneville-Roussy, Arielle ",UK,online,NA,white; white,2126; 1876,"30,16; 30.22","10,9; 11.09",1127; 1013,999; 863,,Groups were split by experimental condition. Employment status was reported (majority students for both groups),47% non-musicians; 53% had some kind of musical training,Volunteers,NA,Various,Western,Precomposed,27 various western genres were used in the study,Akvile Jadzgeviciute,Age differences; conceptual model; musical preferences; test validation
Adopting a music-to-heart rate alignment strategy to measure the impact of music and its tempo on human heart rate,2017,Musicae Scientiae,"Dyck, Edith van",Belgium,NA,NA,NA,32,23.59,2.73,16,16,,"53,13% have had musical training",NA,Volunteers,NA,ambient music,NA,Precomposed,Stimuli were selected to be of adjustable tempi without quality loss.,Akvile Jadzgeviciute,Arousal; heart rate; music tempo; regulation; relaxation
Finding meaning through musical growth: Life histories of visually impaired musicians,2017,Musicae Scientiae,"Park, Hye Young",Republic of Korea,Korea,NA,NA,8,NA,NA,4,4,,Significantly visually impaired,Musicians,Volunteers,NA,NA ,NA ,NA ,,Akvile Jadzgeviciute,Life history research; musical growth; professional musician; visual impairment
Experiential (informal/non-formal) practice does not improve sight-reading skills,2017,Musicae Scientiae,"Zhukov, Katie ",Australia,NA,NA,NA,80,18.88,2.65,56,24,,,Musicians,NA,NA,NA ,NA ,NA ,,Akvile Jadzgeviciute,Collaborative playing; diaries; pitch and rhythm processing; practice; sight-reading; skills for music careers
Conflicts in music in the South Caucasus: The case of Armenians and Azerbaijanis,2017,Musicae Scientiae,"Davidjants, Brigitta ",Estonia,online,Armenia; Azerbaijan,NA,NA,NA,NA,NA,NA,,NA,NA,Other,NA,Traditional folk,"Contested - Armenia, Azerbaijan, Turkey, Iran",Precomposed,"Data was collected from Youtube comments, therefore all of the information about the participants is assumed. The origins of the song being examined is contested.",Akvile Jadzgeviciute,Collective memory; folk song; music and conflict; nationalist identity construction; social media
The effect of authenticity in music on the subjective theories and aesthetical evaluation of listeners: A randomized experiment,2017,Musicae Scientiae,"Wu, Liming ",Germany,online,NA,NA,492,24.42,NA,310,176,,NA,NA,Volunteers,NA,NA ,NA ,experimenter-created,"data was collected on participant's origin country and their parent's origin country, but the data was not reported. One of the exclusion criteria was proximity to Chinese culture.",Akvile Jadzgeviciute,"Aesthetical evaluation; authenticity; empirical aesthetics; music evaluation; music perception; subjective
theories"
Associations between two measures of music aptitude: Are the IMMA and the AMMA significantly correlated in a sample of 9- to 13-year-old children?,2017,Musicae Scientiae,"Dege, Franziska ",Germany,Germany,NA,NA,89,10.75,0.67,46,NA,,"Parental education (54,1% with neither parent holding a HE degree)","Musicians, non-musicians",Volunteers; paid,NA,artificial,NA ,Precomposed,The music stimuli used were part of the testing methodology with IMMA and AMMA tests.,Akvile Jadzgeviciute,AMMA; IMMA; children; musical aptitude; musical aptitude test
The effect of social feedback and social context on subjective affective responses to music,2017,Musicae Scientiae,"Koehler, Katelyn",Australia,Australia,NA,NA,120,20.17,4.4,86,34,,Psychology students,"Music education M=3,56 +-4,23",Volunteers; course credits,NA,NA,Western,Precomposed,STOMP examples of genres per factor were used for the experiment. ,Akvile Jadzgeviciute,Affect; circumplex model; concentration; music listening; social context; social feedback
Recordings as learning and practising resources for performance: Exploring attitudes and behaviours of music students and professionals,2017,Musicae Scientiae,"Volioti, Georgia ",UK,online,UK,NA,204,28.63,13.25,138,66,,Student musicians and professional musicians,Musicians,Other,NA,NA ,NA ,NA ,,Akvile Jadzgeviciute,Expertise; listening preferences; musical performance; practice; recordings
Real-time responses to Stravinsky’s symphonies of wind instruments: perception of internal repetition and musical interest ,2017,Musicae Scientiae,"Xin Wen, Olivia",USA,USA,NA,NA,37,NA,NA,25,12,,Students,"Average experience playing 9,63 years.",Volunteers,NA,Classical,Russia,Precomposed,,Akvile Jadzgeviciute,"Internal repetition; musical interest; repetition
structure; musical features; real-time data"
Psychophysiological indices of music-evoked emotions ,2017,Musicae Scientiae,"Ogg, Mattson",Canada,Canada,NA,NA,30,23,3.5,15,15,,,Musicians,Volunteers,NA,Classical,Western,precomposed,Experiment 1,Akvile Jadzgeviciute,"Psychophysiology; emotion; measurement;
arousal; valence"
Psychophysiological indices of music-evoked emotions ,2017,Musicae Scientiae,"Ogg, Mattson",Canada,Canada,NA,NA,20,21.8,2.5,10,10,,,Musicians,Volunteers,NA,Classical,Western,precomposed,Experiment 2,Akvile Jadzgeviciute,"Psychophysiology; emotion; measurement;
arousal; valence"
The repeated recording illusion: the effects of extrinsic and individual difference factors on musical judgments ,2017,Musicae Scientiae,"Anglada-Tort, Manuel  ",UK,NA,NA,NA,72,24.26,3.6,36,36,,,Musicians; non-musicians,Volunteers,NA,Classical; Popular,Western,precomposed,2 pieces were used - Jailhouse Rock by Elvis and Symphony no 4 by Bruckner,Akvile Jadzgeviciute,Aesthetics; individual differences; explicit information; music performance; judgments and preferences
Roughness of two simultaneous harmonic complex tones on just-tempered and equal-tempered scales ,2017,Musicae Scientiae,"Vencovsky, Vaclav",Czech Republic,NA,NA,NA,15; 18,20-47,NA,2; 3,NA,,Sine-phase condition; Random condition,NA,Volunteers,NA,NA,NA,experimenter-created,Pre recorded intervals were used as stimuli for this study,Akvile Jadzgeviciute,Roughness; just temperament; equal temperament; roughness model; peripheral-ear model
Auditory driving in cinematic art,2017,Musicae Scientiae,"Boltz, Marilyn G.",USA,NA,NA,NA,24,NA,NA,14,10,,Psychology students,non-musicians,Course credit,NA,Electronic,NA,experimenter-created,Experiment 1,Akvile Jadzgeviciute,Auditory dominance; auditory driving; tempo recognition; music-film interactions; audiovisual processing
Auditory driving in cinematic art,2017,Musicae Scientiae,"Boltz, Marilyn G.",USA,NA,NA,NA,24,NA,NA,13,11,,Psychology students,non-musicians,Course credit,NA,Electronic,NA,experimenter-created,Experiment 2,Akvile Jadzgeviciute,Auditory dominance; auditory driving; tempo recognition; music-film interactions; audiovisual processing
Auditory driving in cinematic art,2017,Musicae Scientiae,"Boltz, Marilyn G.",USA,NA,NA,NA,48,NA,NA,26,22,,Psychology students,non-musicians,Course credit,NA,NA,NA,NA,"Experiment 3; a visual que was showneither with original soundrtack, manipulated sountrack or silence.",Akvile Jadzgeviciute,Auditory dominance; auditory driving; tempo recognition; music-film interactions; audiovisual processing
Auditory driving in cinematic art,2017,Musicae Scientiae,"Boltz, Marilyn G.",USA,NA,NA,NA,47,NA,NA,NA,NA,,NA,NA,NA,NA,NA,NA,NA,"Experiment 4; a visual que was showneither with original soundrtack, manipulated sountrack or silence.",Akvile Jadzgeviciute,Auditory dominance; auditory driving; tempo recognition; music-film interactions; audiovisual processing
Blending between bassoon and horn players: an analysis of timbral adjustments during musical performance ,2017,Musicae Scientiae,"Lembke, Sven-Amin",Canada,Canada,NA,NA,16,18-31,NA,3; 6,5; 2,,Bassonists; hornists,Musicians,Paid,NA,Classical,Western,precomposed,"The music piece was used to evaluate timbre adjustment in players, it was not used as a stimulus.",Akvile Jadzgeviciute,Ensemble coordination; music performance; timbre; blend; spectrum
An exploratory study of narrative experiences of music ,2017,Musicae Scientiae,"Margulis, Elizabeth Hellmuth",USA,USA,NA,NA,47,20.9,8,36,11,,Psychology students,Non-musicians,Course credit,NA,Classical,Western,precomposed,,Akvile Jadzgeviciute,Narrative; musical topics; enculturation; music and language; semantics
Creating musical cadences via conceptual blending: Empirical evaluation and enhancement of a formal model ,2017,Musicae Scientiae,"Zacharakis, Asterios",Greece,Greece,NA,NA,20,16.5,NA,NA,10,,Music students,Musicians,Volunteers,NA,NA,NA,experimenter-created,Experiment 1,Akvile Jadzgeviciute,Conceptual blending; musical cadence; computational creativity; empirical evaluation; harmony perception
